{
  "schema_version": "xiaoyou_project_knowledge_v2",
  "knowledge_revision": 6,
  "project": "xiaoyou-hermes",
  "repository": "jinxi1036-maker68/hermes-youyi-product",
  "knowledge_branch": "project-knowledge",
  "code_branch": "main",
  "repository_visibility": "public",
  "updated_at": "2026-09-27",
  "authority": {
    "dynamic_current_state": "knowledge/PROJECT_INDEX.json",
    "current_work": "knowledge/CURRENT_WORK.json",
    "human_current_state": "knowledge/05_CURRENT_STATE.md",
    "human_current_work": "knowledge/CURRENT_WORK.md",
    "active_work_compat": "knowledge/ACTIVE_WORK.md",
    "knowledge_harness": "knowledge/KNOWLEDGE_HARNESS.json",
    "evidence": "knowledge/EVIDENCE_INDEX.json",
    "code": "main branch",
    "deployed_runtime": "production server",
    "working_method": "knowledge/WORKING_METHOD.json",
    "knowledge_concurrency": "knowledge/CONCURRENCY_AND_RECOVERY.md"
  },
  "current": {
    "formal_stage": {
      "id": 3,
      "name": "Direct Message / Outbound",
      "status": "in_progress",
      "sealed": false
    },
    "production_sha": "cb843ccf4545cb40195614f3087cb4efd75cdfa8",
    "production_last_verified_at": "2026-09-28T08:33:00+08:00",
    "main_sha": "cb843ccf4545cb40195614f3087cb4efd75cdfa8",
    "main_last_verified_at": "2026-09-27T23:30:00+08:00",
    "active_work_item_id": "WI-2026-09-stage3-direct-message-outbound-v2",
    "blocker_id": "stage3-capability-contract",
    "blocker_status": "stage3_implementation_ready",
    "blocker_summary": "Owner froze the Stage 3 first slice: explicit human-commanded 1:1 outbound to current authorized internal staff only. Parent/external messaging, bulk/group send and AI-autonomous initiation are out of scope.",
    "next_action": "Inspect existing outbound primitives and implement the smallest Stage 3 direct-message capability that reuses trusted recipient resolution, permission, delivery evidence and idempotent execution without importing later Tasks/Agenda semantics.",
    "working_method_id": "WM-007",
    "working_method_name": "Harness-Routed Role-Locked Governed Adaptive Method",
    "bootstrap_holding_contract": "ADR-009: transparent-forward / persist-before-ACK / idempotent-replay-complete-after-confirmed-success"
  },
  "sealed_capabilities": [
    {
      "id": 1,
      "name": "Identity + Session",
      "status": "pass",
      "stable_tag": "youyi-stable-PASS-identity-authority-2026-09-23",
      "evidence_id": "EV-ID-001"
    },
    {
      "id": 2,
      "name": "Query",
      "status": "pass",
      "stable_tag": "youyi-stable-PASS-query-2026-09-27",
      "evidence_id": "EV-Q-004"
    }
  ],
  "roadmap": [
    {
      "id": 1,
      "name": "Identity + Session"
    },
    {
      "id": 2,
      "name": "Query"
    },
    {
      "id": 3,
      "name": "Direct Message / Outbound"
    },
    {
      "id": 4,
      "name": "Student Basic Writes"
    },
    {
      "id": 5,
      "name": "Student Archive/Delete Semantics"
    },
    {
      "id": 6,
      "name": "People & Organization"
    },
    {
      "id": 7,
      "name": "Student Service Relationships"
    },
    {
      "id": 8,
      "name": "Tasks"
    },
    {
      "id": 9,
      "name": "Task Progress / Contact Owner"
    },
    {
      "id": 10,
      "name": "Agenda Autonomous Work"
    },
    {
      "id": 11,
      "name": "Cross-Service Concern"
    },
    {
      "id": 12,
      "name": "Progressive Claims / Legacy Governance"
    },
    {
      "id": 13,
      "name": "Permission Regression"
    },
    {
      "id": 14,
      "name": "Final Response Truth / UX"
    },
    {
      "id": 15,
      "name": "Learning"
    },
    {
      "id": 16,
      "name": "H5"
    },
    {
      "id": 17,
      "name": "Long-term Stability"
    },
    {
      "id": 18,
      "name": "Voice / Hardware"
    }
  ],
  "roles": {
    "owner": "Product/business decisions, unavoidable production authorization, and final real WeCom/XiaoU acceptance after ChatGPT declares the technical gate ready. May manually relay a ChatGPT-prepared Codex brief only when the execution channel is unavailable.",
    "chatgpt": "Technical lead and GitHub code executor. Owns architecture, planning, repo edits, tests, PR/evidence judgment, next-step control, and Project Knowledge.",
    "codex": "Server executor/verifier only. Owns server inspection, isolated/production verification, deployment, authorized restart/rollback, and factual reporting. On code/architecture blockers, STOP and report; do not redesign or take over GitHub code."
  },
  "freshness_policy": {
    "main": "Always compare current GitHub main HEAD to current.main_sha before code work.",
    "production": "For production-affecting work, require a fresh read-only production verification when production_last_verified_at is stale or the server may have changed.",
    "stale_if_conflict": "If live facts conflict with PROJECT_INDEX.json, stop and refresh project knowledge before implementation."
  },
  "safety": {
    "public_safe_only": true,
    "never_store": [
      "secrets",
      "tokens",
      "environment contents",
      "real student/parent/employee sensitive personal data",
      "chat transcripts",
      "production database backups",
      "authentication headers"
    ]
  },
  "governance": {
    "knowledge_write_mode": "fast_forward_only_optimistic_concurrency",
    "force_push_allowed": false,
    "project_knowledge_branch_protected": false,
    "residual_risk": "Platform-level branch protection is not currently enabled; process-level CAS and Git history are the active safeguards.",
    "material_working_method_changes_require_owner_approval": true,
    "projection_policy": "generated_from_machine_truth_not_hand_edited",
    "current_work_history_policy": "archive_on_close_never_append_history"
  },
  "harness": {
    "version": "KH-003",
    "manifest": "knowledge/KNOWLEDGE_HARNESS.json",
    "current_work": "knowledge/CURRENT_WORK.json",
    "human_current_work": "knowledge/CURRENT_WORK.md",
    "projection_renderer": "knowledge/tools/render_current.py",
    "default_profile": "orientation",
    "projections_generated": true
  }
}
